{
  "api_version": "agent-platform/v1alpha1",
  "kind": "AgentSpec",
  "metadata": {
    "id": "agt_0198f6d0-7ef0-7b0e-a0d3-5f9c96c7f411",
    "key": "programming-agent",
    "namespace": "development",
    "version": "1.0.0",
    "revision": 1,
    "scope": {
      "type": "tenant",
      "tenant_id": "ten_0198f6d0-7ef0-7b0e-a0d3-5f9c96c7f411"
    },
    "labels": {
      "domain": "development"
    },
    "annotations": {},
    "content_digest": "sha256:a1b2c3d4e5f6a1b2c3d4e5f6a1b2c3d4e5f6a1b2c3d4e5f6a1b2c3d4e5f6a1b2",
    "created_at": "2026-09-01T00:00:00Z",
    "created_by": {
      "actor_type": "user",
      "actor_id": "usr_0198f6d0-7ef0-7b0e-a0d3-5f9c96c7f411",
      "tenant_id": "ten_0198f6d0-7ef0-7b0e-a0d3-5f9c96c7f411"
    }
  },
  "spec": {
    "purpose": "在受控代码仓库中完成编程任务",
    "domain": "development",
    "goals": [
      "分析代码库并完成结构化开发任务",
      "运行测试并提供可验证结果",
      "生成高质量、可维护的代码"
    ],
    "non_goals": [
      "未经审批部署生产环境",
      "访问非任务授权仓库",
      "修改系统配置文件"
    ],
    "input_schema_ref": {
      "id": "sch_programming_task",
      "version": "1.0.0",
      "digest": "sha256:e3b0c44298fc1c149afbf4c8996fb92427ae41e4649b934ca495991b7852b855"
    },
    "output_schema_ref": {
      "id": "sch_programming_result",
      "version": "1.0.0",
      "digest": "sha256:a7ffc6f8bf1ed76651c14756a061d662f580ff4de43b49fa82d80a4b80f8434a"
    },
    "prompt_package_ref": {
      "kind": "PromptPackage",
      "id": "prm_0198f6d0-7ef0-7b0e-a0d3-5f9c96c7f411",
      "version": "1.0.0",
      "digest": "sha256:b2c3d4e5f6a1b2c3d4e5f6a1b2c3d4e5f6a1b2c3d4e5f6a1b2c3d4e5f6a1b2c3"
    },
    "context_policy_ref": {
      "kind": "ContextPolicy",
      "id": "cpo_0198f6d0-7ef0-7b0e-a0d3-5f9c96c7f411",
      "version": "1.0.0",
      "digest": "sha256:c3d4e5f6a1b2c3d4e5f6a1b2c3d4e5f6a1b2c3d4e5f6a1b2c3d4e5f6a1b2c3d4"
    },
    "model_policy_ref": {
      "kind": "ModelPolicy",
      "id": "mpo_0198f6d0-7ef0-7b0e-a0d3-5f9c96c7f411",
      "version": "1.0.0",
      "digest": "sha256:d4e5f6a1b2c3d4e5f6a1b2c3d4e5f6a1b2c3d4e5f6a1b2c3d4e5f6a1b2c3d4e5"
    },
    "loop_profile_ref": {
      "kind": "LoopProfile",
      "id": "lop_0198f6d0-7ef0-7b0e-a0d3-5f9c96c7f411",
      "version": "1.0.0",
      "digest": "sha256:e5f6a1b2c3d4e5f6a1b2c3d4e5f6a1b2c3d4e5f6a1b2c3d4e5f6a1b2c3d4e5f6"
    },
    "permission_profile_ref": {
      "kind": "PermissionProfile",
      "id": "pep_0198f6d0-7ef0-7b0e-a0d3-5f9c96c7f411",
      "version": "1.0.0",
      "digest": "sha256:f6a1b2c3d4e5f6a1b2c3d4e5f6a1b2c3d4e5f6a1b2c3d4e5f6a1b2c3d4e5f6a1"
    },
    "skill_bindings": [
      {
        "selector": {
          "domain": "development",
          "status": "active"
        },
        "max_candidates": 8
      }
    ],
    "tool_bindings": [
      {
        "selector": {
          "domain": "development"
        },
        "max_candidates": 5
      }
    ],
    "memory_policy": {
      "readable_scopes": ["user", "tenant"],
      "writable_scopes": ["user"],
      "write_requires_approval": false,
      "max_retention_days": 90,
      "allow_cross_user": false,
      "allow_cross_tenant": false
    },
    "budget_defaults": {
      "max_wall_time_seconds": 3600,
      "max_model_input_tokens": 300000,
      "max_model_output_tokens": 100000,
      "max_model_tokens": 400000,
      "max_cost_usd": "20.00",
      "max_tool_calls": 100,
      "max_iterations": 20
    },
    "approval_defaults": {
      "external_send": true,
      "destructive": true,
      "privileged": true,
      "approval_ttl_seconds": 3600
    },
    "concurrency_policy": {
      "max_parallel_tasks": 10,
      "max_parallel_runs_per_task": 1
    },
    "eval_suite_refs": [
      {
        "kind": "Artifact",
        "id": "art_0198f6d0-7ef0-7b0e-a0d3-5f9c96c7f411",
        "digest": "sha256:a1b2c3d4e5f6a1b2c3d4e5f6a1b2c3d4e5f6a1b2c3d4e5f6a1b2c3d4e5f6a1b2"
      }
    ]
  },
  "status": {
    "phase": "active",
    "observed_revision": 1,
    "activated_at": "2026-09-01T00:00:00Z"
  }
}
